title;shortDescription;longDescription;Kdy;yearBornMin;yearBornMax;classMin;classMax;Kontakt;Location;subject
Robotický projekt;Stavba a programování robotů;Stavba a programování robotů;30.05.2024;2010;2011;;;https://www.matematickaolympiada.cz/;Praha;Matematika
Ekologický výzkum;22;Zkoumání místního ekosystému2;18.04.2024;;;7;9;https://www.matematickaolympiada.cz/;Praha;Programování
Matematický klub;Pravidelná setkání nad zajímavými úlohami;Pravidelná setkání nad zajímavými úlohami;10.03.2024;;;6;8;https://www.matematickaolympiada.cz/;Praha;Chemie
Chemická laboratoř;Praktické experimenty v laboratoři;Praktické experimenty v laboratoři;25.06.2024;2009;2010;;;https://www.matematickaolympiada.cz/;Praha;Fyzika
Fyzikální pokusy;Série zajímavých fyzikálních experimentů;Série zajímavých fyzikálních experimentů;05.05.2024;2010;2012;;;https://www.matematickaolympiada.cz/;Praha;Biologie